{
  "$schema": "https://json-schema.org/draft/2020-12/schema",
  "title": "Librarian Manifest",
  "description": "Librarian runtime state: inventory, cross-reference graph, tag inventory, scan state, drift findings, architect recommendations, rename history. Runtime writes owned by the librarian capabilities. drift_findings declares NO required children: it is a per-scope sub-leaf namespace whose keys are owned by the capabilities that declare writes_manifest_subtree — see drift_findings.description.",
  "type": "object",
  "required": [
    "schema_version",
    "inventory",
    "xref_graph",
    "tags",
    "scan_state",
    "drift_findings",
    "architect_recommendations",
    "rename_history"
  ],
  "properties": {
    "schema_version": { "const": "1.0.0" },
    "inventory": {
      "type": "object",
      "required": ["by_type", "by_path"],
      "properties": {
        "by_type": {
          "type": "object",
          "description": "Map: canonical file type -> inventory records or counts",
          "additionalProperties": true
        },
        "by_path": {
          "type": "object",
          "description": "Map: absolute path -> inventory record",
          "additionalProperties": true
        }
      }
    },
    "xref_graph": {
      "type": "object",
      "description": "Cross-reference graph (wikilinks, canonical-file links, explicit references). Inner shape owned by runtime writer.",
      "additionalProperties": true
    },
    "tags": {
      "type": "object",
      "description": "Tag inventory (tag -> occurrences). Inner shape owned by runtime writer.",
      "additionalProperties": true
    },
    "scan_state": {
      "type": "object",
      "required": ["last_scanned_at", "findings_by_capability"],
      "properties": {
        "last_scanned_at": {
          "type": ["string", "null"],
          "description": "ISO-8601 timestamp of the most recent full-scan cycle"
        },
        "findings_by_capability": {
          "type": "object",
          "description": "Map: capability id -> scan findings record",
          "additionalProperties": true
        }
      }
    },
    "drift_findings": {
      "type": "object",
      "description": "Per-SCOPE drift-finding sub-leaves. Every librarian capability that declares a writes_manifest_subtree owns exactly ONE leaf here, keyed by its own scope: drift_findings.frontmatter (frontmatter-enforce), .placement (placement-validate, itself scope-keyed as .placement.vault / .placement.plans_root), .stale (stale-detect), and the same one-leaf-per-owner shape for tag_coverage, index_maintain, coverage_guard, rename_detected and any later scope. The discipline is structural, not stylistic: manifest_set REPLACES its target leaf wholesale, so a capability that persisted this PARENT object would obliterate every sibling scope's leaf on every run. NO scope key is required and none is enumerated here — a manifest that has never run a given capability simply carries no leaf for it, and additionalProperties:true admits every scope key without the schema tracking the capability roster. A leaf's INNER shape is owned by its writer and lists are legal at any depth: frontmatter carries provides_canonicality / size_monitoring / schema_type_coverage as finding LISTS alongside schema_version + last_scan; placement and stale carry summary objects; rename_detected is a flat list. A long-lived manifest may also carry parent-level residue from before the sub-leaf discipline; it is admitted rather than migrated.",
      "additionalProperties": true
    },
    "architect_recommendations": {
      "type": "object",
      "required": ["last_scanned_log", "items"],
      "properties": {
        "last_scanned_log": {
          "type": ["string", "null"],
          "description": "Path to the most recent architect log file consumed"
        },
        "items": {
          "type": "array",
          "items": {
            "type": "object",
            "additionalProperties": true,
            "required": [
              "id",
              "title",
              "category",
              "confidence",
              "status",
              "source_report",
              "first_seen",
              "last_seen"
            ],
            "properties": {
              "id": {
                "type": "string",
                "pattern": "^AR-[0-9]{3}$",
                "description": "Architect recommendation ID. Pattern AR-NNN avoids collision with ENFORCEMENT-MAP R-NNN rules (per spec §R-C)."
              },
              "title": { "type": "string" },
              "category": { "type": "string" },
              "confidence": { "type": ["string", "number"] },
              "status": {
                "enum": ["open", "deferred", "rejected", "completed", "tracked"],
                "description": "Lifecycle status. Tracked = under active monitoring; completed = recommendation acted on; deferred = revisit next cadence; rejected = decided against; open = newly emitted, awaiting triage."
              },
              "source_report": {
                "type": "string",
                "description": "Path to the architect-{date}.md report that emitted this recommendation."
              },
              "first_seen": {
                "type": "string",
                "description": "ISO-8601 date the recommendation was first emitted."
              },
              "last_seen": {
                "type": "string",
                "description": "ISO-8601 date the recommendation was most recently re-emitted (for convergence tracking)."
              }
            }
          }
        }
      }
    },
    "rename_history": {
      "type": "array",
      "items": {
        "type": "object",
        "additionalProperties": true
      }
    }
  }
}
